{
  "foreverVersion": "0.1",
  "id": "invariant.provenance-preserved",
  "kind": "invariant",
  "name": "Provenance preserved",
  "statement": "Inference is never silently authoritative.",
  "scope": [
    "intent.forever-works"
  ],
  "verification": [
    {
      "type": "external-conformance-suite",
      "expected": "documented and tested",
      "command": "make test",
      "evidence": [
        "evidence.foundation-tests"
      ]
    }
  ],
  "changePolicy": "foundational; explicit major decision required",
  "severity": "critical",
  "relatedCapabilities": [
    "capability.canonical-model"
  ],
  "provenance": {
    "sourceType": "explicit",
    "sourceReference": "foundational proposal",
    "confidence": 1,
    "reviewStatus": "accepted"
  }
}
